sentences,id
Those were the words of a Texas attorney who accidentally joined a Zoom conference of a court hearing while using a filter that made him appear like a fluffy white kitten.,861
Trade war?,860
Pfft.,860
Privacy?,860
Zuck’s problem.,860
Revenue?,860
Endless.,860
Here’s how Tim Cook built Apple into a $2.3 trillion fortress.,860
Wall Street is staying on the sidelines as Tesla’s $1.5 billion Bitcoin purchase sent crypto soaring to a record.,860
Top lenders are still mostly shying away.,860
"Jack Ma’s media portfolio spans investments in newspapers, websites, Twitter-like social platforms and TV production companies.",860
It was much less visible than his Alibaba empire — until an online scandal put it in the spotlight.,860
Brothers Ian and Richard Livingstone built a multibillion-dollar property business.,859
"Despite the pandemic, their fortune has kept climbing thanks to a long-term bet on online gambling.",859
President Biden is refusing to heed Republican appeals to scale back the $1.9 trillion stimulus.,859
The bill is likely to pass with only simple majority support in the Senate.,859
And the proportion of Covid-19 deaths in England and Wales climbed to a record in the last week of January.,859
Almost 46% of total deaths were linked to the virus.,859
Hello!,858
Here's what's hot in markets today.,858
"Bitcoin hit a record above $47,000 early on Tuesday after Tesla announced a $1.5 billion bet and its move to accept the cryptocurrency as payment for electric cars.",858
"Fresh off the GameStop frenzy, Redditraised $250 million from private investors to fund its international expansion.",858
This reportedly values the online forum at $6 billion.,858
And here's how one woman turned a $40 million bet on Chinese video startup Kuaishou into a $12 billion windfall.,858
Dogecoin briefly touched a record Monday after billionaire Elon Musk and rapper Snoop Dogg tweeted about it.,857
The token climbed to a peak of about 8.2 U.S. cents and a market capitalization of $10.5 billion.,857
Renaissance Technologies has been hit with at least $5 billion in redemptions.,857
Unprecedented market swings in 2020 led to the investing giant's worst-ever returns across its public funds.,857
And how much do you know about Covid-19 vaccines?,857
Life-saving shots are coming to end the pandemic.,857
Take our quiz to find out how prepared you are.,857
"Hello, here's what we're following right now:   China arrested an Australian TV anchor on a charge of endangering national security, escalating a case that’s roiled ties between the countries.",856
Hong Kong stocks are about to lose their biggest source of funds.,856
"The trading link allowing mainland investors to buy domestic stocks will shut for the Lunar New Year, effectively slamming the brakes on record levels of inflows.",856
"And Israel won’t reach Covid-19 herd immunity even if all adults are inoculated, the nation’s top public health official said.",856
The global economy’s recovery risks being derailed by the lag in coronavirus vaccinations for poorer nations.,855
Failure to properly immunize the world could come with a $9.2 trillion price tag.,855
"Barclays CEO Jes Staley says the U.K.’s departure from the European Union will prove to be a net benefit for the City of London, even as a post-Brexit deal on financial services remains elusive.",855
"And Will Ferrell will star in GM’s Super Bowl ad, urging Americans to “crush” Norway — when it comes to EVs, that is.",855
Take a look:,855
When will the pandemic end?,854
It’s the question hanging over just about everything since last year.,854
The answer can be measured in vaccinations.,854
Our new Covid calculator is designed to show you how long it will take (based on each country's current vaccination rate) for enough people to be inoculated to achieve herd immunity.,854
"At today’s global rate, it will take the world an estimated 7 years to cover 75% of the population with a two-dose vaccine.",854
"But some of the world’s biggest vaccine-manufacturing hubs are just getting started, so rates are bound to increase.",854
Scroll down to “The Path to Immunity” to select your country or state:,854
"The U.S. is on pace to vaccinate 75% of its population against Covid-19 this year, while Canada would need almost a decade to do so.",853
Here's a snapshot of some places around the world that are off to fast and slow starts.,853
The way the pandemic reshapes where and how we work could be one of the most visible legacies from the health crisis.,853
"""Work from home"" has become ""work from anywhere.""    It has no revenue and zero analyst coverage.",853
"But penny stock Abra Mining has become the most-traded name in the Philippines, surging 103% this year as retail mania goes global.",853
How can a city have too little and too much water?,852
"While climate change and extreme weather are factors, the main culprit for Chennai’s water problems is poor planning.",852
"Democracy in Southeast Asia is stumbling, writes Bloomberg Opinion columnist Clara Ferreira Marques.",852
The military takeover in Myanmar is a poor signal for the wider region.,852
"And we’ll leave you with one last thing: a $1,200 umbrella.",852
The U.S. economy is showing signs of picking up from an end-of-year slowdown.,851
The tentative improvement could muddy President Biden's efforts to pass a $1.9 trillion stimulus package.,851
GameStop shares continued their rapid fall back toward Earth on Wednesday.,851
The stock slid 7% in U.S. premarket trading.,851
The vast majority of people who contract Covid-19 still have antibodies at least six months after infection.,851
Some 88% of participants in a new study retained antibodies for half a year.,851
"The meme stocks that Robinhood originally restricted have lost $167 billion in a matter of days, and there’s little sign the pain is easing.",850
Our annual innovation index is here.,850
The U.S. dropped out of the top 10 while South Korea returned to first place.,850
Amazon’s incoming CEO Andy Jassy is arguably the most important person in tech over the past decade — and uncannily similar to Jeff Bezos.,850
Amazon said Jeff Bezos will transition to the role of Executive Chair in the third quarter of 2021 and Andy Jassy will become Chief Executive Officer at that time.,849
"“In the Exec Chair role, I intend to focus my energies and attention on new products and early initiatives,” Bezos said in a letter to employees:",849
An early but positive milestone in the fight against Covid-19: More Americans have now received at least one dose of a Covid-19 vaccine than have tested positive for the virus.,848
"GameStop's spectacular rally unwound further Tuesday, after bearish investors appeared to cover their positions and trading volume shriveled.",848
"And Joe Biden has signaled he's intent on a large pandemic relief bill, potentially without Republican support, even after a White House meeting with GOP senators on Monday.",848
Hello!,847
Here are our top markets reads today.,847
China is in export overdrive — and hogging shipping containers.,847
"That's sparked turmoil in supply chains worldwide, with food piling up in all the wrong places.",847
GameStop mania was tempered by a largely invisible Wall Street instrument that emerges when things get wild.,847
And here's how much investors could have lost from Robinhood's trading restrictions.,847
Few people care who made their flu shot or other immunizations.,846
"Covid changed that, turning vaccine makers into household names.",846
But for now most people won't get to decide which shot they get.,846
Joe Biden must decide whether to break up a $1.9 trillion Covid-19 relief proposal after the GOP offered a $600 billion deal.,846
Biden will meet with Republicans to discuss it on Monday.,846
Elon Musk says one of his startups has a monkey with wires going into its brain that’s able to play video games.,846
"""He’s a happy monkey,"" said the Tesla CEO.",846
"Hello, here's what we're following right now:   In Myanmar, Aung San Suu Kyi and other top leaders were detained by the army in an early-morning raid, said the country’s ruling party.",845
"According to reports, the military has taken power for one year.",845
"Lines of communications were spotty, making it hard to get information.",845
The price of silver surged as the Reddit-inspired stock market frenzy spills over into commodities.,845
Retail sites were overwhelmed with demand for bars and coins over the weekend.,845
And Hong Kong’s notorious subdivided flats — crowded and sometimes no bigger than a single bed — are sparking a Covid crisis.,845
"GameStop and other day-trader favorites surged back after Thursday’s tumble as brokerages said they would start to ease trading restrictions, setting the scene for another wild day on the markets.",844
Meanwhile Robinhood raised more than $1 billion from existing investors and drew millions more from bank credit lines to weather the storm.,844
And away from markets: Poland has a new billionaire — thanks to a pandemic-fueled boom in postal lockers.,844
"Robinhood drew down some of its bank credit lines to ensure it has enough cash to clear trades, sources say.",842
"In a Bloomberg TV interview, Robinhood CEO Vlad Tenev said the company did so to protect its financial position.",842
"Watch the clip below, or the full video here:   It’s tapped at least several hundred million dollars, a significant amount of money for a firm that was valued at about $12 billion a few months ago, according to one of the people.",842
Britain may help the EU shore up its Covid-19 vaccine supplies as AstraZeneca faces severe disruption.,841
The EU failed to convince the drugmaker to divert doses from the U.K. to make up for a production glitch in Europe.,841
"GameStop resumed its rally in early U.S. trading, after a brief outage of the Reddit forum whose users have fueled the stock’s surge.",841
The shares were up 24% at $431 at 6:15 a.m.,841
New York time.,841
"The stock has advanced more than 1,700% this year.",841
"And oil and gas companies knew they would face a fight with President Joe Biden, who had campaigned on tackling climate change.",841
But nobody expected fossil fuel to come under such an immediate attack.,841
"In 11 hours of pure market mania, a new band of day traders sent a range of fringe stocks to gains of 100% or more.",840
"We tracked what happened in real time:    You might be wondering whether you should also buy GameStop, AMC and other Reddit-hyped stocks.This is what some financial pros say:    And in pandemic news: After strict border curbs, mass testing and hard lockdowns, China is using a new method to tackle coronavirus outbreaks: anal swabs.",840
French drugmaker Sanofi has agreed to produce 125 million doses of BioNTech and Pfizer's coronavirus vaccine in an unusual collaboration to speed vaccinations efforts in the EU.,839
GameStop has continued its skyward march in U.S. premarket trading after an Elon Musk tweet.,839
"The stock rose as high as $260, up 76% from the last close.",839
And the conviction of billionaire Beny Steinmetz has been hailed as a milestone in the fight against corruption in mining.,839
But it's not clear whether he'll ever set foot in prison.,839
"Hello, here’s what we’re following in markets right now:  • On any given day, there may be a dozen tiny, profitless companies that mysteriously go from obscure penny stocks to viral sensations.",838
Here's how it happens.,838
• GameStop’s surge accelerated as shares nearly doubled on Tuesday.,838
"Michael Burry of “The Big Short” fame called the rally “unnatural, insane and dangerous.”   • And short-squeezed hedge funds are now getting hit on their bullish bets too.",838
Germany is urging the EU to limit vaccine exports as a standoff with drugmaker AstraZeneca worsens.,837
AstraZeneca has said that planned deliveries of its Covid-19 jab would face delays.,837
Private equity titan Leon Black paid Jeffrey Epstein $158 million between 2012 and 2017 — after the sex offender pleaded guilty to felony charges.,837
"Here's what Black, one of America's richest men, got for his money.",837
And it seems that money can buy happiness after all.,837
A new study refutes the theory that above a certain income level dollars don't help your sense of well-being.,837
House Democrats triggered the start of an unprecedented trial by delivering a single article of impeachment against Donald Trump to the Senate.,836
Ice melting has accelerated so much over the past 30 years that it’s now in line with the worst-case climate warming scenarios outlined by scientists.,836
And a shortage of auto chips has made global leaders realize how dangerously dependent they are on Taiwan for semiconductors.,836
"Meanwhile, China is pushing the world to avoid official dealings with the island democracy.",836
"As Covid-19 rages, governments are debating whether to prioritize giving as many people as possible a first shot of vaccine, or to reserve supply for a second dose.",835
Here's why delaying the second shot is messy.,835
"The world is witnessing the greatest rise in inequality on record, according to Oxfam.",835
"While the rich have already bounced back, the world's poorest are likely to feel the effects of the pandemic for years.",835
"Cryptocurrency enthusiasts counting on Bitcoin to surge back above $40,000 face  faltering demand for the biggest fund tracking the digital asset, according to JPMorgan Chase.",835
"The pace of flows into the fund ""appears to have peaked.""",835
Hello  Here’s what we're following right now:   China's growing power is scaring ordinary savers out of Hong Kong.,834
"Outflows this year could reach $36 billion to the U.K. alone, says Bank of America.",834
Mexico’s president says he’s infected with Covid-19.,834
The nation has seen record increases in cases and fatalities in the past week.,834
Robinhood saw a huge boost among rookie traders.,834
But now they’re giving up the DIY investing apps and turning to financial advisers for help instead.,834
"Bitcoin tumbled below $30,000 from recent record highs.",833
Analysts warn the drop below the key level could be a sign of further losses ahead.,833
"Millions of barrels of Venezuelan crude, embargoed by the U.S., have been surreptitiously going to China.",833
Documents reviewed by Bloomberg show the lengths to which some traders disguised the oil’s origin and got it to Asia.,833
These are the 50 companies worth watching in 2021.,833
"We tracked about 2,000 companies in fields including finance, retail and technology, and came up with a shortlist.",833
Explore:,833
Joe Biden will issue a sweeping set of executive orders to tackle the Covid-19 pandemic.,832
"The new president will seek to overhaul testing, stabilize the supply chain and boost vaccine distribution.",832
"Biden will also order people to wear masks in airports and on planes, and enforce quarantines for international travelers.",832
A negative Covid-19 test will be required before flying to the U.S.    And a Bloomberg analysis finds that total direct emissions from the world's biggest oil company may be twice as much what it reports publicly.,832
"President Joe Biden said Donald Trump left him a ""very generous letter"" before leaving Washington on Wednesday.",831
Twitter locked the official account for the Chinese embassy in the U.S. after a post defended Beijing’s policies in Xinjiang.,831
Critics say China is engaged in the forced sterilization of minority Uighur women there.,831
"New York is looming toward a vaccine shortage, Hong Kong is set to approve Pfizer’s shot and Biden will re-engage with the WHO.",831
Here's the latest virus news:,831
"Joseph Robinette Biden Jr. was sworn in as the 46th president of the United States, taking control of a nation wracked by a deadly pandemic, persistent unemployment and growing social unrest:   China imposed sanctions on former Secretary of State Michael Pompeo and other Trump administration officials, saying they had made “crazy moves” that harmed U.S.-China ties:   U.S. stocks rallied as investors grew optimistic that recent federal spending will revive growth and bolster corporate earnings:",830
"It's inauguration day in the U.S. Joe Biden plans to begin immediately unwinding Trump’s policies with at least 15 executive actions, including moves to rejoin the Paris climate accord and the WHO.",829
"Donald Trump granted clemency to dozens of people, including his former strategist Steve Bannon and the rapper Lil Wayne.",829
The list of pardons and commutations doesn’t include the president himself.,829
"Billionaire Jack Ma resurfaced for the first time in nearly three months, sending Alibaba Group's stock soaring.",829
Speculation had grown recently about Ma’s whereabouts.,829
"Hello, here's what we're reading (and watching) right now:   Wealthy investors rushed to offload Alibaba stock after China launched a probe into its alleged monopolistic practices, according to Citigroup’s private bank.",828
A team at NASA’s Jet Propulsion Laboratory is proposing a mission that will let us see planets in other solar systems.,828
"We spoke with the scientist behind what could be the most powerful telescope ever built, with a little help from the sun.",828
Taiwan became the world's best stock market during Trump's presidency.,828
"Its benchmark index surged 92% since 2017, in part due to the trade war.",828
"To defeat the pandemic, children will have to be immunized, experts say.",827
Pfizer and Moderna have started recruiting for studies to show their shots are safe and effective for kids.,827
Airlines have been looking forward to Covid vaccines to rescue their battered industry.,827
But European carriers are becoming fearful that a recovery will arrive too late for summer travel.,827
Donald Trump departs Washington with Americans more politically divided than when he arrived.,827
It's an ignominious end to one of the most turbulent presidencies in American history.,827
This coding prodigy had a string of flops before hitting it big with battle-royale shooting game PUBG.,826
Now his firm is aiming for an IPO that could value it at up to $27 billion.,826
Donald Trump is expected to grant a flurry of pardons in his final act as president.,826
Sources say he isn't giving himself clemency in anticipation that he might later be charged with federal crimes.,826
"Sci-fi action game Cyberpunk 2077's disastrous rollout sparked an investor lawsuit, customer uproar and two apologies from the developer's CEO.",826
Here's an inside look at how the project imploded:,826
White House officials are planning a farewell ceremony for Donald Trump as he leaves Washington for the last time as president.,825
He won't be attending Joe Biden's inauguration.,825
"Like all new drugs, Covid-19 vaccines come with some safety concerns and side effects.",825
Here's what you need to know about vaccine-related deaths and allergies.,825
And global gaps in access to vaccines are raising concerns about dangerous new versions of the pathogen.,825
Vast numbers of countries have yet to begin their vaccination campaigns.,825
"Hello  Here's what we're following right now:   China’s economy expanded 2.3% in 2020, boosted by 6.5% growth in the final quarter, making it the only major country to avoid a contraction.",824
"Russian police detained opposition leader Alexey Navalny, an outspoken critic of President Vladimir Putin, as he arrived in Moscow after being treated in Germany for poisoning.",824
The arrest will pose an early test for Joe Biden’s incoming administration.,824
"And wealthy Americans, by some measures, have become richer during the pandemic than ever before.",824
"With the economic collapse and surge in joblessness, homelessness, and hunger, it’s a difficult thing to fathom.",824
"Rules governing the City of London’s relationship with Europe are still uncertain after Brexit, but one outcome is already clear: a stream of dealmakers across the English Channel.",823
"Norway says Covid-19 vaccinations may be too risky for the very old and terminally sick, after 23 people died within a short time of receiving their first shot.",823
And Apple is planning a new line of upgraded MacBook Pro laptops — and the return of its magnetic charger.,823
"A year after its first coronavirus lockdowns, China’s economy is beating the world.",822
Economists expect the country’s GDP to expand 8.2% this year.,822
Many Asian economies that tamed the virus early are taking a wait-and-see approach before rolling out vaccines.,822
"Here’s why:    And Donald Trump plans to live at his Mar-a-Lago resort in Florida, employing several White House staff members.",822
Some neighbors are not happy.,822
President Donald Trump's historic second impeachment heads to the Senate.,821
"His fate now rests with Republican leader Mitch McConnell, who has more leverage than ever over the president.",821
Americans rushing to get vaccinated against Covid-19 face limited supplies and jammed phone lines.,821
"With eligibility expanded this week, another 128 million Americans can potentially get shots.",821
And Bitcoin mining is coming to the Article Circle.,821
The Siberian city of Norilsk now hosts a crypto farm for producing new Bitcoins —  a process that requires expensive cooling.,821
Donald Trump just became the first president in U.S. history to be impeached twice.,820
"Here’s what happens next:    Elon Musk loves China, and China loves him back — for now.",820
"Tesla’s unprecedented success there has helped its CEO become the world’s richest man, but how long can the good times last?",820
"And in Japan, preparing for natural disasters is serious business.",820
Architects and engineers are pushing boundaries to reduce damage.,820
"Tokyo Skytree, the world’s tallest broadcasting tower, is designed to let strong winds simply pass through its gaps.",820
The rest of the world could learn a lot from Japan’s strategies:,820
The U.S. House is preparing to vote on whether to impeach Donald Trump over his role inciting last week’s mob attack on the Capitol.,819
"If the vote passes, Trump would become the only U.S. president to be impeached twice.",819
"After taking a soft approach to the pandemic, Sweden plans to crack down on private gatherings and businesses that fail to follow restrictions.",819
"But with deaths surging, some say it is too little too late.",819
And the fate of Tokyo's Olympics is once again in doubt as Japan declares a second state of emergency.,819
Organizers have said the 2020 Olympics will be canceled if they can’t go on as scheduled in summer 2021.,819
Breaking: The U.S. House voted to demand that Vice President Mike Pence remove Donald Trump from office by invoking the 25th Amendment and declaring the president incapable of executing his duties.,818
It went ahead with the resolution even though Pence said just hours before that he wouldn’t comply.,818
But emotions are running high after a mob of Trump supporters stormed the Capitol last week.,818
"If the vote does not persuade Mike Pence to remove Trump, Democrats will proceed with a historic impeachment vote just eight days before Joe Biden is inaugurated.",818
The abrupt resignation of the U.S. Homeland Security chief has added to tensions ahead of Joe Biden’s inauguration next week.,817
The FBI has warned of armed protests in all 50 state capitals.,817
"From health certificates to new taxes and additional paperwork, U.K. businesses are drowning in red tape at the EU border under the new Brexit rules.",817
And South Korean police are on the hunt for a female casino executive who disappeared after her employer discovered 14.6 billion won ($13 million) in cash missing from the resort’s coffer.,817
WhatsApp’s new privacy rules have sparked an exodus by users and an outcry among tech experts and privacy advocates.,816
Here's what the policy says and what it means.,816
It took Trump’s entire presidency for most of his corporate allies to turn on him.,816
"They’re standing up to him now, when their pressure can’t change much in the administration’s final days.",816
But they do have the power to hurt his return to the business world.,816
"And we’d like to introduce you to our new video series, China+, which dives into how the country’s international projects affect the rest of the world.",816
Watch the first episode:,816
Bitcoin's wild ride took another twist Monday as the worst two-day tumble in the digital currency since March stoked concern that the cryptocurrency boom may run out of steam.,815
House Speaker Nancy Pelosi is readying Democrats for a lightning-fast second impeachment of President Donald Trump this week.,815
The move risks consuming Congress in a bitter political fight.,815
"And at least 250,000 small companies in the U.K. are set to close in 2021 unless the government provides more assistance, as the economy heads for a double-dip recession.",815
"Hello, here's what we're following right now:   Donald Trump and a dwindling circle of advisers are planning a defiant final week in office, sources say, despite growing calls to impeach the president or remove him from office.",814
Japan says it found a new strain of the coronavirus in four passengers arriving from Brazil.,814
Wreckage was recovered from a Boeing passenger jet that crashed in Indonesia shortly after takeoff on Saturday.,814
The plane carrying 62 people was intact when it hit the water.,814
A police officer has died of injuries he sustained when a pro-Trump mob broke into the Capitol on Wednesday afternoon.,813
"Pfizer and BioNTech’s vaccine appears to be effective against a key mutation in fast-spreading new coronavirus strains, researchers say.",813
"And in an effort to clean up its image, Amsterdam aims to restrict tourists from visiting a key attraction: its marijuana-selling coffee shops.",813
