sentences,id
It may contribute to explaining why some ethnic groups are more susceptible to severe disease than others.,1201
The days of leasing stores for $1 million a month are over in Hong Kong.,1201
The world’s most expensive retail rents tumbled to a decade low.,1201
And here’s where Xi Jinping may strike next in China’s regulatory crackdown:,1201
China is wrecking one of the world's most profitable bond trades.,1200
And investors are bracing for more pain.,1200
The crypto world is fixated on the handful of “whale” wallets that control most of the Shiba Inu tokens — and it's worried one is about to sell.,1200
"SoftBank is hemorrhaging top talent at its $100 billion startup fund, and paying its billionaire founder first isn't helping matters.",1200
China’s latest Covid outbreak — which recently ensnared [hundreds of students](   South Korean payments app Kakao Pay surged over 150% in its Seoul debut.,1199
Its IPO was seen as a litmus test for investor sentiment after a regulatory crackdown.,1199
"In the U.S., Taiwanese American Michelle Wu broke barriers after she became the first woman and first person of color elected as Boston's mayor.",1199
Day two of COP26 in Glasgow is providing a showcase for small countries -- among the world’s most vulnerable to climate change.,1198
The Amazon rainforest is being stolen and cleared at an accelerating pace.,1198
It’s nearing a point of no return.,1198
Virginia’s election offers the clearest picture yet of how much momentum Republicans have heading into 2022.,1198
It’s not just a problem of moving stuff around.,1197
The world is still struggling to make enough stuff too.,1197
"A year ago, Beijing kicked off a sweeping crackdown.",1197
Here's how it changed corporate China forever.,1197
"Forget crypto and junk bonds, individuals can now get a whopping 7.12% from a U.S. government savings bond.",1197
"Hello  Here's what we're reading:    Dozens of world leaders and corporate executives are gathered in Glasgow for the [COP26 climate talks](    Elon Musk, the world’s richest man, challenged a UN official’s claim that just a small percentage of his wealth could help solve world hunger.",1196
And Britain is starting to confront the unthinkable question: What happens when Queen Elizabeth II dies?,1196
Facebook is now Meta.,1195
"Here’s what you need to know:   • The company is changing its corporate name, highlighting a shift in focus to virtual reality, but its flagship app will still be called Facebook.",1195
The stock will start trading under the ticker MVRS on Dec. 1.,1195
"• The rebranded name has multiple meanings, which could get confusing for traders and consumers around the world.",1195
• And a leaked photo shows Meta is developing an Apple Watch competitor with a front-facing camera and rounded screen.,1195
"Bulls are returning to China’s markets thinking things can’t get much worse, but the risks are just starting to multiply.",1194
"Singapore’s health officials are looking into an “unusual surge” in daily Covid cases, which topped 5,000 for the first time.",1194
"They can carry a nuclear warhead, fly low and be hard to detect.",1194
Here’s what to know about hypersonic weapons as competition between the U.S. and China escalates.,1194
The cryptocurrency Shiba Inu hit a new high after rising 13% in 24 hours.,1193
It's now the 11th biggest coin with a market cap of nearly $24 billion.,1193
"Chinese state media blasted John Oliver’s segment on Taiwan, saying he “dodged facts” and misled the public about the self-ruled island.",1193
“Squid Game” has exposed South Korea’s dark side to a global audience.,1193
Here’s a deep dive to truly understand the country’s growing inequality.,1193
U.S. lawmakers are eyeing Facebook’s algorithms as they investigate how online platforms spread malicious content.,1192
A Bloomberg Businessweek analysis of how 15 global cities rank for career women shows each failing in several ways.,1192
Elon Musk is now worth more than Exxon Mobil.,1192
Hong Kong rejected pleas from global banks to scrap its Covid Zero strategy as it moved to close more quarantine loopholes.,1191
"China’s mystery “authoritative person,” widely believed to be Xi’s right-hand man, has resurfaced to explain the country’s crackdowns.",1191
“Not subordinate”: Why two words from Taiwan’s leader threaten to upend U.S.-China ties.,1191
Facebook left investors in the dark about its waning popularity with teens and young adults.,1190
That’s now forming the basis of a whistle-blower’s SEC complaint.,1190
"Barely four months out of bankruptcy, Hertz placed an order for 100,000 Teslas in the first step of an ambitious plan to electrify its rental-car fleet.",1190
London Heathrow airport will work with start-up Vertical Aerospace on establishing flying-taxi services at the U.K. hub by mid-decade.,1190
Hello  Here's what we're following:    China expects its latest Covid outbreak to worsen in the coming days.,1189
It has locked down thousands in the north to contain the spread.,1189
"Shiba Inu soared to record highs over the weekend to become the 11th-biggest cryptocurrency by market value, but then fell after Elon Musk said he doesn’t own any.",1189
Some Chinese companies single-handedly create more carbon emissions than entire countries.,1189
We took a close look at the country's hidden polluters.,1189
Everything is about to get more expensive as makers of consumer goods face a dire mix of supply-chain challenges and rising costs.,1188
Evergrande pulled back from the brink of default just before Saturday’s deadline.,1188
President Biden said he doesn’t think there are enough Democratic votes to raise tax rates in a deal on his economic agenda.,1188
Hello   Here’s what we're following today:     Joe Biden says the U.S. would come to Taiwan’s defense if attacked by China.,1187
"Just days after launch, the first Bitcoin ETF is already in danger of becoming too popular for its own good.",1187
And these are the hidden ways the ultrarich pass wealth to their heirs tax-free:,1187
Breaking: Indiajust administered its billionth Covid shot.,1186
But data show not enough have taken a second dose.,1186
Donald Trump is planning a new media and technology empire called Truth Social.,1186
"Here's the pitch deck for his social-media platform:    After Bitcoin touched a record of nearly $67,000, some bulls believe $100,000 is once again within reach.",1186
Turkmenistan has a dirty secret: It’s one of the world’s worst emitters of planet-warming methane.,1185
"New York City will mandate Covid-19 vaccinations for all city workers, scrapping a testing option.",1185
A report that Facebook Inc. plans to change its corporate name prompted a flurry of online speculation.,1185
"The first U.S.-listed Bitcoin ETF made a strong debut, jumping 4.9% and becoming the second-highest traded fund ever in a watershed moment for crypto.",1184
"Xbox’s mini fridge started as a joke on Twitter, but it's proven to be a hit.",1184
"The $99.99 fridge, which resembles the gaming console, sold out for preorders in 15 minutes.",1184
This is the reclusive dictator behind one of the world's worst methane problems:,1184
"₿ Bitcoin is climbing toward all-time highs ahead of its first futures exchange-traded fund in the U.S.    A few generations after their ancestors were scratching out meager livings, Shenzhen’s urban villagers have quietly amassed vast riches.",1183
It’s now becoming a Chinese mega-city.,1183
These are the best (and worst) pension systems in the world.,1183
"Apple took the most aggressive step yet to strip Intel chips from its computers, announcing more powerful homegrown Mac processors alongside a total revamp of the MacBook Pro.",1182
"Boris Johnson said the global climate talks the U.K. is hosting at the end of October will be “extremely tough,” as he made a last-ditch call on world leaders to take concrete steps to protect the planet.",1182
Watch the full interview with Bloomberg:    And there’s a $30 billion fortune hiding in China’s Silicon Valley.,1182
The U.K. is falling behind the rest of Europe in its battle against Covid-19.,1181
Google wants to run its latest campus entirely free of emissions.,1181
It’ll take far more than money to make that happen.,1181
The Federal Reserve’s army of economists says Wall Street is getting its inflation call wrong.,1181
"China’s GDP growth slowed to 4.9% in the third quarter, down from 7.9% in the previous quarter, over a property slump and an energy crisis.",1180
A zainichi woman — a third-generation Korean born in Japan — has brought a lawsuit against an employer who distributed anti-Korean propaganda in the office.,1180
It’s one of the first trials for the country’s new laws against racist and hateful speech.,1180
"And a new show has knocked ""Squid Game"" out of Netflix's No. 1 spot in the U.S.",1180
"As out-of-practice pilots return to the skies, potentially disastrous errors are mounting, an aviation database reveals.",1179
"Vaccinated travelers can enter Sydney and the rest of Australia’s New South Wales without quarantine from Nov. 1, as the country emerges from isolation.",1179
Something strange is happening with North Korea’s currency.,1179
"Counterintuitively, the won is surging just as things get worse.",1179
A tropical storm that’s lashing southern China mixed with Covid-related supply chain snarls is causing a ship backlog from Shenzhen to Singapore.,1178
"Opaque methods, hypothetical numbers and ‘bonkers’ adjustments are shifting New York City’s property-tax burden toward the middle- and working-class.",1178
"Can you really work fewer hours for the same pay, while maintaining productivity?",1178
"Yes, according to this study in Iceland.",1178
"Mixing Covid vaccines produces as much or more antibodies as using the same shot as a booster, according to preliminary results of a U.S. government-sponsored trial.",1177
"Kyle Bass lost big in his bet against the Hong Kong dollar, and the SEC says some investors funded his short through an illicit stock offering.",1177
Citi CEO Jane Fraser has a plan to turn around the bank and crush its rivals.,1177
It involves betting on its wealth business and letting employees rewrite their schedules.,1177
The U.S. will relax coronavirus restrictions at its land borders with Canada and Mexico for vaccinated travelers next month.,1176
"The EU plans to offer a package of concessions to the U.K. that would ease trade barriers in Northern Ireland, as the two sides prepare for a new round of contentious Brexit negotiations.",1176
"And the U.S. has become the world’s biggest Bitcoin miner, replacing China, where a crackdown has effectively eliminated the practice.",1176
Hong Kong’s $6.3 trillion stock market canceled its morning session as typhoon Kompasu lashed the city.,1175
Securities trading may be affected for all of Wednesday.,1175
"Apple will likely slash production targets for the iPhone 13 by as many as 10 million units this year because of prolonged chip shortages, sources say.",1175
Why are new Covid outbreaks deadlier in some countries than others despite using the same vaccines?,1175
Explore what the data show.,1175
The U.S. House will vote on an increase to the government’s borrowing limit Tuesday.,1174
"While it should avert the immediate threat of a catastrophic default, it could set the stage for an even bigger showdown.",1174
America’s aging oil and gas sites are a climate menace.,1174
Meet the company that owns more of them than any other.,1174
₿ Bitcoin is flirting with a record-high after jumping more than 90% since July.,1174
The divide is growing between Asia’s two main financial hubs in handling Covid.,1173
"As Singapore opens up travel to the rest of the world, Hong Kong still has one the world’s harshest quarantines, risking the city's global status.",1173
"Asian stocks and U.S. futures fell Tuesday, struggling to shake off worries about inflation spurred by an energy crunch and the possibility of a widening Chinese crackdown.",1173
And today in billionaire spats: Elon Musk doesn’t want Jeff Bezos to forget who the world’s richest person is.,1173
Five traders tell us how they survive and thrive in a world of disrupted markets.,1172
"Nearly a quarter of U.S. critical infrastructure—utilities, airports, police stations and more—is at risk of being inundated by flooding, according to a new report.",1172
"Hong Kong Chief Executive Carrie Lam defended Covid-19 travel restrictions that are frustrating global businesses, signaling the curbs will stay in place for the foreseeable future.",1172
Hello  Here's what we're reading right now:   Demand for coal is moving back near peak levels.,1171
"For all the promises to transition to green energy, the world still leans heavily on fossil fuels.",1171
Read more in Bloomberg Green:    Southwest Airlines pilots asked a court to temporarily block the company from carrying out federally mandated Covid vaccinations.,1171
"And it’s time for the Apple Watch to break free from the iPhone, Mark Gurman [writes](",1171
"The Senate approved legislation to pull the U.S. from the brink of a payment default, breaking a weeks-long standoff that rattled financial markets.",1170
"After years of finger-pointing over the collapse of a real-estate company, the tycoon behind the crash is now sitting on a $9 billion mountain of debt.",1170
Journalists Maria Ressa and Dmitry Muratov won the Nobel Peace Prize for their work to safeguard freedom of expression.,1170
The two will share the $1.1 million prize.,1170
"China’s energy crisis is starting to ripple around the world, hitting everything from iPhones to milk to cardboard boxes.",1169
"A U.S. nuclear-powered attack submarine struck a mystery object in the South China Sea last week, the Navy said.",1169
About a dozen sailors suffered minor to moderate injuries.,1169
The most magical place on Earth is also one of the most... colorful places to work.,1169
Here are 11 very un-magical secrets one man learned during a week working at Disney World.,1169
The Senate is nearing a deal to increase the debt ceiling that would pull the U.S. from the brink of a payment default.,1168
"₿ Exactly how cryptocurrency Tether is backed, or if it’s truly backed at all, has always been a mystery.",1168
"Now, it’s in the crosshairs of U.S. regulators and prosecutors.",1168
"Global food prices are at the highest in a decade, and the energy crisis is threatening to make things even worse.",1168
"A federal judge temporarily blocked Texas’s new ban on most abortions, handing a major early victory to the Biden administration as it seeks to overturn the strictest such law in the nation.",1167
Sweden and Denmark halted the use of Moderna’s Covid vaccine for people under 18 because of potential side effects.,1167
The Swedish health authority cited an increased risk of heart inflammation.,1167
Hong Kong’s national security law has transformed the financial hub and raised big questions for individuals and companies alike.,1167
Dive into the data tracing the fallout:,1167
"European gas prices surged again, bringing their gains over just two days to 60%, as the EU sounded the alarm.",1166
Slowing methane leaks is critical in the fight to slow climate change.,1166
Here’s where the potent gas comes from and what can be done now.,1166
"And the U.K.’s Prime Minister Boris Johnson put forward his vision for a new Britain, investing in skills, narrowing social inequalities and “unleashing” a national spirit.",1166
"Mark Zuckerberg responded to whistle-blower Frances Haugen's claims, saying accusations about Facebook prioritizing profit over user safety are “just not true.”    Merck's Covid pill is being touted as a game changer.",1165
Here's everything you need to know about the new treatment.,1165
China is now the last country still chasing a Covid zero policy.,1165
"Its attempts to stamp out every last case have left it isolated, with borders firmly closed.",1165
Facebook blamed a global service outage that kept its social media apps offline for much of Monday on a problem with its network configuration.,1164
European natural gas and power soared to fresh records amid worsening fears over supply.,1164
And U.S. Secretary of State Antony Blinken met French President Emmanuel Macron in Paris as America looks to move past a spat over a defense agreement with Australia and the United Kingdom.,1164
"Facebook, WhatsApp and Instagram suffered a devastating outage that shut out many of its 2.7 billion global users.",1163
The apps started coming back online at about 5:45 p.m.,1163
"New York time, more than six hours after problems began.",1163
Mark Zuckerberg lost more than $6 billion in a matter of hours as Facebook’s stock plummeted on Monday.,1163
A global selloff in stocks continued in Asia on Tuesday.,1163
Here’s what else is moving markets:,1163
The U.S. is moving closer to its first-ever default with neither political party in Washington yet signaling it’s ready to back down.,1162
This was supposed to be the year the U.K. broke free of the EU and forged ahead as a buccaneering free trader.,1162
"Instead, it’s struggling to find enough workers and facing its toughest winter since the 1970s.",1162
OPEC+ remains very much in control of the oil market as ministers gather later Monday for a meeting amid a worsening global energy crunch.,1162
Hello  Here’s what we’re following today:   Shares in Evergrande and its property management unit were suspended from trading in Hong Kong on Monday.,1161
Follow the latest developments:    Anthony Fauci said the U.S. is turning the corner on the current Covid surge and more people need to get vaccinated to keep infections declining.,1161
"The key risk is the 70 million eligible people who still haven’t gotten a shot, he added.",1161
"A Facebook whistleblower who leaked thousands of internal documents unveiled herself as Frances Haugen, a former product manager who has accused the company of placing profits over users’ well-being.",1161
U.S. House Speaker Nancy Pelosi plans to try again Friday for a vote on infrastructure legislation that’s been held up by a battle over President Biden’s economic agenda.,1160
Inflation in the euro area is at a 13-year high.,1160
There’s more to come.,1160
The $2.5 trillion fashion industry wasn’t spared the wrath of the pandemic.,1160
Here’s how Covid-19 is transforming it.,1160
"Breaking: House Democrats delayed a vote on a bipartisan $550 billion infrastructure deal, hours after President Joe Biden signed a stopgap funding bill to avert a government shutdown on Friday.",1159
"China ordered its top state-owned energy companies — from coal to electricity and oil — to secure supplies for this winter at all costs, sources say.",1159
"Australia does worse than Kazakhstan, Serbia and Zimbabwe on women’s participation in the economy — and it’s costing the country billions.",1159
"U.S. President Joe Biden is set to avoid a disruptive shutdown of the federal government, but deal-making continues on his economic agenda.",1158
The risks facing investors and the global economy are growing.,1158
Here’s what three titans of the financial industry are most worried about.,1158
Japan’s next prime minister has gone viral with an unusual photo.,1158
Developers that are making games for an upcoming Nintendo 4K console were surprised to learn that the latest model of the Switch... won’t support 4K graphics.,1157
"U.S. Senate Majority Leader Chuck Schumer said lawmakers reached a deal to avoid a government shutdown on Friday, extending government spending until Dec. 3.",1157
The exodus of Hong Kong bankers to China is accelerating — in part because of the city’s strict quarantine measures.,1157
Insider trading is everywhere.,1156
"So far, no one seems to care.",1156
The U.K. will deploy the government’s reserve tanker fleet on Wednesday to help ease its fuel crisis.,1156
"China’s hidden local government debt has surged to more than half the size of its economy, Goldman Sachs says.",1156
Hello  Here’s what we’re following right now:   The world’s wealthiest family is revealing $5 billion worth of its stock picks.,1155
"The Waltons kept their investments quiet for years, but that’s proving increasingly harder to do.",1155
"China is running out of coal, which means higher prices for the rest of the world.",1155
"And Ireland is now the best place to be during the pandemic, while Southeast Asian nations remain the worst.",1155
See how your country fared in our Covid resilience ranking:,1155
Europe’s energy supply shortages will likely get worse just as the winter season starts.,1154
"The country that makes breakfast for the world has been scorched, frozen and then dried out by the worst drought in a century.",1154
It’s an ominous warning of what’s to come.,1154
Female investment bankers in the U.K. make just 56% of the money their male colleagues do.,1154
The U.S. raised Covid risk levels to “moderate” in Hong Kong — which has posted zero local infections since August — and “high” in Singapore.,1153
"Supply chains have been snarled by soaring costs for raw materials, long port delays and shortages of shipping containers.",1153
Now add China’s energy crisis to the mix ahead of the holiday season.,1153
Harvard Business School moved all first-year and some second-year MBA students to remote learning after a “steady rise” in breakthrough Covid infections.,1153
Europe’s energy crisis is coming for the rest of the planet.,1152
Germany’s Olaf Scholz urges the Greens and Free Democrats to join him in government as soon as possible.,1152
A U.S. child-care crunch could leave some mothers behind as they look to rejoin the labor force.,1152
Germany’s elections [failed](   China’s next economic shock — a power crunch — may be just around the corner.,1151
Looking to invest in Asia?,1151
"Ideas from our expert panel vary widely, from companies that make EV parts to those that deliver soy milk to the booming middle classes.",1151
"China’s central bank said all cryptocurrency-related transactions are illegal and must be banned, sending the strongest signal yet on its determination to crack down on the industry.",1150
The nation’s economic planning agency said it is an urgent task for China to root out crypto mining and the crackdown is important to meet carbon goals.,1150
"The announcement sent Bitcoin, Ether and other digital tokens tumbling.",1150
"Meanwhile, cryptocurrency stocks also declined.",1150
"Argo Blockchain slumped 10% in London, while Bitcoin miner Northern Data lost 2% in Frankfurt.",1150
China sentenced the former chairman of liquor giant Moutai to life in prison for taking $17.5 million in bribes.,1149
"Female MBA grads in the U.S. earn $11,000 less than their male peers, a study found.",1149
"The gap widens to more than $60,000 a decade out from graduation.",1149
And here’s what China’s Evergrande crisis could mean for your money:    Exclusively for Bloomberg.com subscribers: Sign up for our new Deals newsletter to get the latest news and analysis on everything from startup investing to the growing world of SPACs.,1149
"People over 65 and high-risk adults can receive a Pfizer booster in the U.S., the FDA said.",1148
Scientists have been divided over the need for a third vaccine dose.,1148
The U.S. Federal Reserve signaled it may start withdrawing emergency pandemic support for the economy and revealed a growing inclination to raise interest rates in 2022.,1148
"And Apple store employees will get bonuses of up to $1,000 next month, a rare move following the company's rocky efforts to get retail operations back on track.",1148
"Hello, here’s what we’re following:   A first-year analyst at Goldman, whose father is vice chairman of a major client, ignited a junior banker uprising earlier this year.",1147
He played a key role in assembling the unauthorized slide deck that laid out trainees’ frustrations and then went viral.,1147
Hong Kong has quietly widened the national security law with a small shift in language.,1147
"Films, charities and other organizations are now at risk for anything “contrary to” the city’s security interests.",1147
Why is everyone talking about Evergrande?,1147
It’s China’s biggest financial worry right now and is quickly becoming a problem elsewhere.,1147
Here’s what you need to know.,1147
"Breaking: Justin Trudeau is poised to win a third term as Canada’s prime minister, staving off a stiff challenge from his Conservative rival.",1146
A global stocks rout hit the world’s biggest fortunes.,1146
The richest 500 people lost a combined $135 billion on Monday.,1146
"A selloff continues in Asia as investors worry about the debt crisis engulfing Chinese property developer Evergrande, among other risks.",1146
Here's how markets are moving:,1146
Hello  here are some of our top stories today:   The global housing market is broken — and is dividing entire countries.,1145
"The 25 wealthiest families on the planet added $312 billion to their collective fortunes, a 22% gain since last August.",1145
"Bats in Laos were found to carry coronaviruses that share a key feature with the pathogen that causes Covid-19, moving scientists closer to finding what causes the virus.",1145
The World Bank is abandoning its Doing Business report over ethical concerns.,1144
"It has accused former CEO Kristalina Georgieva, who is now Chair of the IMF, of applying pressure to boost China’s position in the ranking.",1144
"Victims of Bernard Madoff's Ponzi scheme are about to get the first payouts since he died in jail, with a fund preparing to send out $568 million in checks.",1144
