sentences,id
**Asia's Richest:** A reversal in the extraordinary growth of Indian family fortunes has dragged down the overall net worth of Asia's wealthiest.,1627
"From Ambanis to the Mistrys, here are the 20 richest families in the region right now.",1627
**India-Russia:** US officials proclaimed themselves satisfied that India is buying Russian oil below G-7 price caps.,1627
But market experts say it’s not so clear.,1627
"**India Power:** Coal India, which accounts for about four-fifths of the nation’s output of the fuel, is aiming to boost supplies to power plants this summer as unusually hot weather drives electricity demand.",1627
"US prosecutors were investigating Signature Bank’s work with crypto clients before regulators suddenly seized the lender this past weekend, sources say.",1626
"Justice Department investigators were examining whether the New York bank took sufficient steps to detect potential money laundering by clients — such as scrutinizing people opening accounts and monitoring transactions for signs of criminality, sources added.",1626
"Biden plans to hold a phone call with Chinese President Xi Jinping once the legislature concludes its annual gathering and the government in Beijing returns to work, National Security Adviser Jake Sullivan says.",1625
"After imposing three years of sacrifice, President Xi's government let Covid tear through China's population in two months.",1625
Moving on won’t be easy.,1625
"The collapse of Silicon Valley Bank was swift and brutal, leaving much of the world to wonder what will come next.",1625
Here's how the US Federal Reserve is handling the crisis.,1625
"Everything Everywhere All at Once” wrapped its hot dog fingers around Hollywood’s top prize, winning Best Picture along with awards for Michelle Yeoh, Ke Huy Quan and Jamie Lee Curtis.",1624
Daniel Kwan and Daniel Scheinert’s metaphysical multiverse comedy emerged as an improbable Academy Awards heavyweight with seven wins.,1624
LIVE BLOG: The consequences of the collapse of Silicon Valley Bank continue to play out across the globe.,1623
"Join us for news, analysis and market reaction to this developing story.",1623
"SVB, a lender little-known outside of Silicon Valley, has sparked a wave of panic in tech circles that dragged down banking shares around the world.",1622
"Events snowballed after Silicon Valley Bank announced a share sale to shore up its finances, following a significant loss on its portfolio.",1622
Here's what you need to know:,1622
"Apple is shaking things up and overhauling international sales to focus on India, signaling the nation's growing prominence for the tech giant.",1619
The shift will mark the first time that India becomes its own sales region at Apple.,1619
The news comes as the company began producing some iPhone models in the country to diversify beyond China.,1619
"China set a modest economic growth target for the year, a sign the nation’s top leaders are still concerned about the recovery, given weak consumer confidence, declining exports and a housing market still under pressure.",1616
"Beijing will target gross domestic product expansion of around 5% for 2023, Premier Li Keqiang said in his final government work report to the National People’s Congress — the annual parliamentary gathering — on Sunday.",1616
"A passenger train collided with an oncoming freight train in northern Greece early Wednesday, killing 16 people and injuring at least 85, fire service officials said.",1615
"Multiple train cars derailed and at least three caught fire at the site near Tempe, some 380 kilometers (235 miles) north of Athens.",1615
"Hong Kong will stop requiring masks to be worn in public places from Wednesday, drawing to a close the prolonged Covid era that damaged its economy and standing in the world.",1614
"Masks will no longer be needed outdoors, indoors or on public transport, Hong Kong leader John Lee said.",1614
"India's central bank slows the pace of rate hikes, raising the cost of borrowing money to 6.5%, to tamp down core inflation",1613
"Baidu surges after affirming it’s on track to publicly roll out its ChatGPT-like service in March, stoking anticipation around potentially China’s most prominent entry in the race to create lifelike AI bots.",1612
A powerful earthquake struck southern Turkey before dawn on Monday killing multiple people.,1611
"Rescue workers are racing to save a number of people trapped after apartment buildings collapsed in several provinces, the government said.",1611
"The quake with a preliminary magnitude of 7.4 struck at a depth of 5 kilometers with an epicenter near the city of Gaziantep, according to Turkey’s Kandilli observatory based in Istanbul.",1611
GFZ Helmholtz Centre Potsdam put the magnitude of the quake at 7.7.,1611
"Chinese internet giant, Baidu, is planning to debut an artificial intelligence chatbot service in March, according to sources.",1610
"The tool, which remains unnamed at this point in time, will allow users to receive conversation-style search results similar to OpenAI’s ChatGPT, marking China's most prominent entry in the race to adopt AI.",1610
"The news comes after ChatGPT gained interest in China, with some users sharing conversations over social media despite internet censorship.",1610
"The selloff in Gautam Adani’s empire accelerated on Friday, erasing almost $45 billion of market value in less than two sessions as Asia’s richest man struggles to contain the fallout from a scathing report by US short seller Hindenburg Research.",1609
It’s piling pressure on the Indian tycoon as it erodes his net worth.,1609
Concerns about the group’s finances have percolated throughout the tycoon’s rise.,1609
But the Hindenburg report alleging fraud has put a harsh spotlight on the group’s corporate governance — as well as that of India as a whole.,1609
"The US Justice Department is poised to sue Alphabet’s Google as soon as Tuesday regarding the search giant’s dominance over the digital advertising market, according to people familiar with the matter.",1608
"The case is expected to be filed in federal court before the end of the week, said the people, who asked not to be named discussing a confidential matter.",1608
"Ken Griffin’s Citadel churned out a record $16 billion in profit for clients last year, outperforming the rest of the industry and surpassing the ""greatest trade ever.""  The top 20 hedge fund firms collectively generated $22.4 billion in profit after fees, according to estimates by LCH Investments, a fund of hedge funds.",1607
"Citadel’s gain was the largest annual return for a hedge fund manager, surpassing the $15 billion that John Paulson generated on his bet against subprime mortgages.",1607
"Google parent Alphabet said it will eliminate about 12,000 jobs, more than 6% of its global workforce, becoming the latest tech giant to retrench after years of abundant growth and hiring.",1606
"The layoffs will affect jobs globally and across the entire company, CEO Sundar Pichai told employees in an email on Friday, writing that he takes “full responsibility for the decisions that led us here.”",1606
"Cryptocurrency lender Genesis Global Capital filed for bankruptcy, the latest firm to collapse in the aftermath of FTX’s swift downfall.",1605
"The firm filed for Chapter 11 bankruptcy on Thursday in the Southern District of New York, court documents show.",1605
It said its estimated assets and liabilities range between $1 billion to $10 billion.,1605
New Zealand Prime Minister Jacinda Ardern announced a shock resignation despite being expected to seek a third term in this year's election.,1604
The country is set to hold elections in October.,1604
"The Labour party will now need to elect a new leader in the coming days, which is expected to conclude no later than Feb. 7 allowing Ardern to resign.",1604
"Amazon is laying off more than 18,000 employees in the latest sign that a technology slump is deepening.",1603
"The reduction, a significantly bigger number than previously planned, is concentrated in the firm’s corporate ranks, mostly its retail division and human resources functions like recruiting.",1603
"Nearly 37 million people in China may have been infected with Covid-19 on a single day this week, according to estimates from the government’s top health authority.",1602
"As many as 248 million people, or nearly 18% of the population, likely contracted the virus in the first 20 days of December, according to minutes from an internal meeting that were confirmed with people involved in the discussions.",1602
"If accurate, the infection rate would dwarf the previous daily record of about 4 million, set in January 2022.",1602
"Former FTX executive Gary Wang and Alameda Research chief Caroline Ellison have pleaded guilty to criminal charges and are cooperating with US prosecutors, who are probing the crypto platform's collapse.",1601
Sam Bankman-Fried has been extradited back to the US and is expected to appear in federal court in Manhattan on Thursday.,1601
"Elon Musk says Twitter will restrict voting on major policies to paying subscribers, in one of his first tweets after a poll found he should step down.",1600
The US is concerned China’s runaway Covid outbreak might spawn new mutations of the virus.,1600
"The tech bust is hollowing out San Francisco, as empty offices, a crypto meltdown and crime deepen the pain.",1600
"BREAKING: Twitters users have told Elon Musk to step down as the site's chief, in a poll the billionaire said he would respect.",1599
"About 58% of the 17.5 million votes cast were in favor of Musk stepping back from the leadership role, a sharp rebuke of his chaotic tenure less than two months since he took over.",1599
The Fed made its last rate hike of the year and says it isn't done with efforts to vanquish inflation — but Wall Street investors don't quite buy it.,1598
"The Bahamas jail housing Sam Bankman-Fried had a rat and maggot infestation as well as buckets for toilets, a 2020 report said.",1598
It could change his mind on extradition to the US.,1598
"A racist tweet during the European Championship set off a firestorm in the UK, and an elite London firm found its toxic culture at the center of the fight.",1598
"Sam Bankman-Fried, the disgraced co-founder of FTX, was arrested in the Bahamas after the US government filed a criminal indictment.",1597
"Hong Kong is scrapping some of its remaining Covid restrictions, following China’s rapid shift away from the zero-tolerance approach.",1597
The changes allow international arrivals to go to bars and restaurants.,1597
"And BTS fans gathered near an army training base to say farewell to Jin, the oldest member of the K-pop supergroup, as he started his 18 months of mandatory military service.",1597
The abrupt end of Covid Zero may push the death toll above 2 million and overwhelm China with infections.,1596
Tesla investors are increasingly worried Elon Musk is distracted with overhauling Twitter.,1596
The carmaker's stock is under renewed pressure after having lost more than $500 billion in market value this year.,1596
Rebel farmers are fighting back against climate rules that they say make it impossible to feed the world and stay in business.,1596
Peru President Pedro Castillo triggered a political crisis by attempting to dissolve congress in what the constitutional tribunal described as a coup.,1595
Vice President Dina Boluarte took over as head of state after Castillo was impeached and detained.,1595
"Former Theranos COO Ramesh “Sunny” Balwani was sentenced to 13 years in prison for fraud, a longer term than Elizabeth Holmes.",1595
Emerging-market debt is sliding into distress.,1595
"Ghana, which once pitched itself as business-friendly and politically stable, is now a cautionary tale as it seeks a $3 billion IMF bailout.",1595
"China is set to further relax Covid rules, allowing home quarantine as a nationwide policy and scrapping “unnecessary” testing, as soon as Wednesday.",1594
"Meanwhile, Xi Jinping is getting the red-carpet treatment in Saudi Arabia for a regional summit that will give the Chinese leader and Prince Mohammed bin Salman a chance to showcase the Gulf’s deepening ties with Beijing.",1594
The $300 billion fortune of the world’s richest family eclipses even the Waltons' wealth.,1594
Professional investors are betting a recession can be avoided despite all the warnings to the contrary.,1593
Here's why it's a dangerous move.,1593
Former Chinese President Hu Jintao was seen in public for the first time since his mysterious exit at a key party meeting last month.,1593
"He attended a tribute for [Jiang Zemin](   The treatments that saved the lives of patients with severe Covid have come at a cost, with some continuing to suffer ""nightmarish"" effects long after leaving the ICU.",1593
[](  [](   Here's why Joko Widodo's ambitious $34 billion plan to build a new Indonesian capital is falling apart.,1592
[,1592
Heavy police presence in China's major cities [deterred](   Elon Musk's new gambit for Twitter could be his riskiest yet: a war with Apple.,1591
Can this Indian startup city become the next Singapore or Dubai?,1591
A clash between police and workers in the sprawling Chinese complex known as iPhone City shows how grim conditions have become under China’s Covid Zero policy.,1590
"Read The Big Take    The ringgit surges for a second day to become Asia's best-performing currency, as investors await Anwar Ibrahim's cabinet lineup    Crypto billionaire Changpeng “CZ” Zhao says he's aiming to create a roughly $1 billion fund for the potential purchase of distressed digital assets",1590
"**Here’s what we’re following right now: **  China's daily Covid cases climbed to the highest of the pandemic, hitting 29,754 — a challenge to officials told to be more targeted with virus curbs.",1589
[   Federal Reserve officials at their meeting earlier this month concluded it would soon be appropriate to slow the pace of rate hikes.,1589
"[   Nintendo’s latest blockbuster release for the Switch — Pokémon Scarlet and Violet — is the company’s biggest debut on any platform, scoring 10 million sales globally in its first three days.",1589
[,1589
Hundreds of workers at Apple’s main iPhone plant in China clashed with security staff after being locked up for weeks to quash a Covid outbreak.,1588
[   Top partners at Sequoia Capital apologized to investors for backing FTX.,1588
Follow the latest developments in the fallout from the collapse of Sam Bankman-Fried's crypto exchange here.,1588
"[   Hong Kong's financial analysts worry even mild criticism of China may lead to reprimand, job loss or prosecution under the powerful national security law.",1588
[,1588
"Walt Disney brought back former leader Bob Iger to replace his successor Bob Chapek as chief executive officer, a surprise move by the board after a string of disappointing quarters.",1587
"Covid Zero has returned to the Chinese city rumored to be reopening, a potential sign officials are reverting to tighter virus curbs as cases multiply.",1587
Australia’s spat with China leaves exporters like wine merchants and seafood sellers facing a hard time finding alternative markets.,1587
FTX's new boss has slammed Sam Bankman-Fried's leadership for non-existent oversight and the misuse of client funds as advisers struggle to locate billions of dollars in missing assets.,1586
Twitter closed its offices after Elon Musk gave employees a stay-or-quit ultimatum that sparked an exodus.,1586
Here's the memo:    Joe Tsai's family office is betting on luxury hotels as it increasingly diversifies the fortune of the Alibaba co-founder.,1586
"Republicans have won enough seats to control the US House of Representatives, and they may push Biden for a more hawkish approach to China.",1585
Chinese President Xi Jinping confronted Canadian PM Justin Trudeau at the G-20 summit over leaks to the media — a heated exchange caught on camera.,1585
"The global elite is driving a boom in private air travel, and regulators are scrambling to keep carriers that break the rules out of the skies.",1585
He's back.,1584
Donald Trump has formally entered the race for US president in 2024.,1584
NATO faces difficult decisions after Poland said a deadly blast near its border was caused by a Russian-produced rocket.,1584
"China's super-rich are decamping to Singapore in ever greater numbers — and the cost of luxury cars, mansions and golf-club memberships is soaring.",1584
The meeting between US President Joe Biden and Chinese leader Xi Jinping turned out much better than expected.,1583
"""We must not let the world fall into another cold war,"" said Indonesian President Jokowi at the first session of the G-20 Summit.",1583
Follow the latest here.,1583
"Binance's Changpeng ""CZ"" Zhao has cast himself as crypto's new savior.",1583
"**Here’s what we are following right now:**   US President Joe Biden will try to prevent ties with China from worsening further when he meets Xi Jinping on Monday, the first in-person meeting between the two world leaders since the pandemic started.",1582
A swift plunge in the value of FTX’s key crypto assets suggests that customers have a slim chance of recovering their deposits.,1582
"China and Covid, soaring Fed rates, as well as an energy crisis.",1582
There's plenty to disrupt the global economy in 2023.,1582
"The crisis sparked by the collapse of Sam Bankman-Fried’s FTX has ensnared BlockFi, a troubled crypto lender once worth $3 billion but which is now unable to operate business as usual.",1581
"Elon Musk, in his first address to Twitter employees since buying the social network, said that bankruptcy was a possibility.",1581
Billionaire Gautam Adani's expansion into Sri Lanka has put him in the middle of a fight between India and China.,1581
"**Here’s what we’re following right now: **  The struggle for control of the US Senate now comes down to which party wins two of the last three races, as Republicans limped toward House control.",1580
"[   FTX faces [bankruptcy](   Apple has imposed a time limit on AirDrop transfers for iPhones sold in China, after protesters used the file-sharing tool to spread images.",1580
[,1580
Republicans made gains in the US House while Democrats stayed competitive in Senate contests with mid-term elections underway.,1579
Follow who's winning the race for Congress here.,1579
"Binance's Changpeng “CZ” Zhao became the undisputed crypto king with a move to take over FTX.com, the troubled firm led by his chief rival and onetime disciple, Sam Bankman-Fried.",1579
Elites in Russia are increasingly worried that the rise of outspoken hawks in the Kremlin will further harden Putin.,1579
Elon Musk is under pressure as Twitter's debt load jumps to about $13 billion.,1578
But rapid cost cuts aren't necessarily the best path to profitability.,1578
"Some of China’s most persistent virus hotspots have been locked down for weeks, sometimes even months, showing the limitations of the country’s contentious Covid Zero policy.",1578
"As Europe races to fill the gap left by Russian gas, it is leaving the world's poorest countries facing social unrest, blackouts and factory shutdowns.",1578
"You might have to wait longer to get the latest phones from Apple, after China lockdowns affected operations at the world's largest iPhone factory.",1577
"Meanwhile, China's daily Covid cases jumped to a six-month high.",1577
"After laying off roughly half its workforce in an email on Friday, Twitter is now reaching out to dozens of employees who lost their jobs and asking them to return.",1577
"When the Ukraine war began, the West rushed to seize Russian oligarchs’ yachts.",1577
But the idle boats have become a burden for some taxpayers.,1577
Twitter will begin slashing jobs on Friday as tech companies from Apple to Amazon [tighten their belts](   The metals for your electric vehicles are stuck in a 30-mile traffic jam.,1576
Don't look up.,1576
"A Chinese rocket booster is headed for an uncontrolled fall through the atmosphere Friday, sparking concerns pieces could crash to Earth.",1576
"After the Fed's fourth straight jumbo rate hike, Jerome Powell made clear he's prepared to continue tightening to stamp out inflation, shifting the focus from the size of the next increase to where rates will peak.",1575
The wild swings in Chinese stocks this week on social-media rumors show how big shorts can quickly turn dangerous.,1575
Blackstone's blockbuster real estate fund is a $70 billion force in a now-faltering property market.,1575
Rising rates and financial tumult are giving some investors second thoughts.,1575
North Korea fired at least 10 ballistic missiles in a one-day record after warning it would retaliate against US and South Korean military drills.,1574
"With a key financial summit underway, Hong Kong is trying to convince the world that the city remains the go-to place in Asia after three years of strict Covid restrictions and political upheaval.",1574
"Spectators at the upcoming Qatar World Cup could be allowed to stage peaceful protests, promote LGBTQ rights, and even kiss in public.",1574
Credit Suisse is not for sale; this is what the bank's chairman has to say to bargain hunters hoping to snap up the Swiss lender.,1573
A first-hand account from a Foxconn worker who walked 25 miles to escape a Covid lockdown at the world's largest iPhone factory.,1573
This is how creative math helps companies exaggerate their progress when it comes to tackling pollution.,1573
"South Korea launched an investigation into the [Halloween crowd crush](   Luiz Inacio Lula da Silva defeated incumbent Jair Bolsonaro, 50.9% to 49.1%, in a runoff vote to become Brazil’s next president.",1572
It's a dramatic comeback for the left-wing politician who was languishing in a jail cell just three years ago.,1572
"Traders are bracing this week for four major events that could shape the market’s outlook for the rest of the year, including rate decisions by the Fed and Bank of England.",1572
"Elon Musk completed his $44 billion takeover of Twitter, with CEO Parag Agrawal among the executives who are leaving.",1571
Apple delivered just enough good news in its quarterly report to avoid the fate of most tech giants this earning season.,1571
Xi's $6 trillion rout shows China markets serve the Communist Party first.,1571
Breaking: Elon Musk told Twitter employees he doesn’t plan to cut 75% of staff when he takes over the company.,1570
Samsung heir Jay Y. Lee formally took the helm of the $250 billion company as its new executive chairman.,1570
"After an unprecedented wealth boom, the American middle class is facing its biggest hit in a generation.",1570
"Adidas's breakup with Ye has wrecked the rapper's path to a [multibillion-dollar fortune](   The new Covid boosters that target the omicron variant aren't better than the old ones, a study finds.",1569
What is crypto?,1569
It took a whole issue of Bloomberg Businessweek to answer — and you'll be an expert by the end.,1569
"Rishi Sunak will formally [become UK prime minister](   In a reversal from Monday's dramatic selloff, Chinese stocks rebounded after earlier [wiping $35 billion](   We go inside the complicated relationship between UBS's CEO and his powerful wealth czar.",1568
"In a stark rebuke of Xi Jinping’s move to stack China's leadership ranks with loyalists, investors on Monday sold off Chinese stocks listed in Hong Kong, with a key benchmark tumbling to the lowest level since 2008.",1567
"The country also dropped key economic data, including GDP for the third quarter, after they were unexpectedly delayed without a reason last week.",1567
"The figures paint a mixed recovery, with better-than-expected 3.9% economic growth alongside rising unemployment and weaker retail sales.",1567
"Meanwhile, over in the UK, former Chancellor Rishi Sunak is a step closer to becoming the next prime minister after Boris Johnson pulled out of the leadership contest.",1567
Hello!,1566
Here's a special weekend update from China's twice-a-decade leadership reshuffle:   The six top officials who will rule alongside Xi Jinping for the next five years have just been revealed.,1566
"Get to know who they are:   Allies were promoted at the expense of potential rivals, solidifying Xi's control over the world's second-largest economy.",1566
"It also affirmed China’s shift in a more conservative direction, without a single woman on the Politburo for the first time in a quarter century.",1566
Read more of the key takeaways here:,1566
“Markets are calling the shots.”,1565
UK traders say Liz Truss's departure after a month of economic chaos is a warning to future leaders.,1565
The [next prime minister](   Advisers to Elon Musk and Twitter are preparing paperwork to complete the $44 billion buyout by Oct. 28.,1565
"Meanwhile, US officials are discussing whether to subject [Musk’s ventures](   Inside Dubai's property boom, fueled by the super-rich from [Mukesh Ambani](",1565
Hong Kong will relax property rules for foreigners and grant two-year visas for high earners in an attempt to revive its status as a financial hub.,1564
"Kakao's co-CEO resigned from the $16 billion internet giant after a widespread outage of its service, used widely by Koreans, businesses and government officials, caused chaos.",1564
See the extraordinary rise and fall of the Covid billionaires:,1564
"China has made a decision to seize Taiwan on a “much faster timeline” than previously thought, US Secretary of State Antony Blinken said.",1563
A sanctioned tycoon once dubbed the Myanmar junta’s “No. 1 crony businessman” is enjoying the good life in Singapore.,1563
See how Russian ships are laundering grains stolen from Ukraine and covering their tracks.,1563
