sentences,id
"Moderna’s experimental vaccine successfully protected 16 monkeys against heavy exposure to Covid-19, an encouraging step on the path to a defense for humans.",487
"And finally, Hong Kong is facing its worst outbreak yet — but it can't just go into lockdown.",487
Here's why:,487
A new study of a Covid-19 outbreak among passengers on a January flight is one of the first to document a probable transmission on a plane.,486
"Gold just smashed a record, and every major bank agrees that it'll cross $2,000 an ounce.",486
Now forecasters are asking whether the peak is near.,486
Here's where experts say you should invest $1 million to ensure your post-pandemic future.,486
This may be one of the Arctic’s last summers with ice.,485
It’s warming so fast it has become an accelerator of climate change in the rest of the world.,485
"The ice cap's white surface reflects sunlight back into space, effectively cooling the planet.",485
"When the ice melts, it’s replaced by ocean, which is dark and absorbs the light, heating up the sea surface.",485
"In other words, what happens in the Arctic doesn’t stay in the Arctic.",485
Freaked-out scientists and gleeful captains of fossil-fuel tankers are witnessing history.,485
Get a front-row seat here:,485
"Before the hack earlier this month, Twitter contractors were caught spying on celebrity accounts, including Beyoncé:   While Congress debates extending federal unemployment benefits, thousands of Americans still haven't received the $600 checks in the first place:   An environmental activist is shot dead, sparking a long and twisting investigation.",484
But will her killers getaway with murder?,484
"Health officials around the world are trying to tackle second waves of the pandemic, with outbreaks from China to Spain underlining the difficulty of stamping out the virus.",483
Gold futures traded at a record as the dollar plunged and concerns about the global economy boosted demand for havens.,483
Hedge-fund fees were already shrinking before the pandemic ripped through global markets but now they're in terminal decline.,483
Coronavirus cases are soaring in young adults who are tired of social distancing.,482
"The fact that they’re less at risk for a severe infection or death has emboldened them to break restrictions, whether that’s commuting to work or partying at a nightclub.",482
A little-known crypto startup hatched one of the most ambitious plans yet to unify the world’s various blockchain platforms — and it’s got the backing of the Chinese government.,482
And these elite contact tracers are showing everyone else how to beat Covid-19:,482
New York’s reopening is taking shape differently across boroughs—driven largely by income and race:    Dogs with a few days of training are capable of identifying people infected with the coronavirus:    One in three renters in the U.S. failed to make their full payment in the first week of July.,481
Nearly 12 million renters could be served with eviction notices in the next four months:,481
"Euro skeptics are now believers after a landmark rescue package spearheaded by Germany and France, and it's driving markets higher.",480
"After a gap of nearly a century, Istanbul's iconic Hagia Sophia on Friday echoed with the sounds of Islamic prayer.",480
Goldman Sachs reached a deal that would see Malaysia drop all criminal charges against the bank in exchange for $3.9 billion of reparations for its role in raising money for the troubled sovereign wealth fund 1MDB.,480
"Hello   Here's what we're following:   U.S. Secretary of State Michael Pompeo described China’s leaders as tyrants bent on global hegemony, hearkening back to the language of the U.S.-Soviet standoff during the Cold War.",479
China's red-hot IPOs are minting a new billionaire every week.,479
"At least 24 people have entered the billionaires' club in the first half of the year, including former teachers, accountants and software developers.",479
Warnings are getting louder that tech stocks are in a bubble.,479
"Just three days after the Nasdaq 100’s biggest rally since April, those gains are now history.",479
How one big manufacturer beat ransomware attackers without paying the ransom:    The little-known Chinese entrepreneur who built TikTok into one of the hottest apps out there is under pressure to save the business from a possible U.S. ban:    China repeated its pledge to provide universal access if it develops a coronavirus vaccine:,478
"Less than four months before the U.S. election, Donald Trump has made his tough China policy a centerpiece of his campaign to stay in power.",477
"The mayor of Portland, Oregon, was tear gassed by the U.S. government Wednesday during another night of protest against the presence of federal agents in the city.",477
"China embarked on its most ambitious space mission yet, launching a probe to Mars that ramps up the nation's challenge to NASA's dominance in space.",477
Hello  Here's what we're following:    Authorities raided Apple and Amazon offices in Italy over a ban on reselling Beats headphones.,476
The companies are suspected of unfairly curbing the sale of Apple's Beats products by anyone other than members of its official reseller program.,476
"These Asian stocks have benefited the most from the pandemic, threatening some traditional market leaders:    Does a U.S. ban on TikTok even make sense?",476
"It would leave a giant social media hole, writes Bloomberg Opinion columnist Tae Kim.",476
Here’s what’s at stake:,476
"Billions spent on small business loans helped save between 1.4 million and 3.2 million jobs during the coronavirus pandemic, according to a new study byMIT:   Ben and Jerry’s made fighting injustice its brand.",475
Its customers love it:   Africa is starting to have second thoughts about all those Chinese investments:,475
"China vowed retaliation after the U.S. forced the closure of its Houston consulate, in one of the biggest blows to diplomatic ties between the two countries in decades.",474
"The Trump administration deployed agents with tactical gear to confront protesters in downtown Portland, Oregon, sparking debate over the use of federal power as local and state officials.",474
"The differences between European and U.K. markets are looking starker than ever, after EU leaders forged a historic rescue deal to save the bloc's weakest economies.",474
"A pair of college friends from China are among the most prolific hackers ever, the U.S. says.",473
"The Justice Department accused Li Xiaoyu and Dong Jiazhi of hacking coronavirus research, military secrets and information on dissidents.",473
"The former classmates, who studied computer technologies, stole secrets worth hundreds of millions of dollars over the course of more than 10 years, according to an indictment unsealed this week.",473
Senior officials said this shows how China used criminal hackers to do some of its dirtiest work.,473
The smoking-gun link appears to be special software provided by a state handler.,473
Keep reading:,473
The U.S. accused two hackers of working for the Chinese government to steal coronavirus research from companies in 11 nations:    More than 40 current and former Ubisoft employees spoke with us about sexual misconduct and abuse allegations.,472
"They say the company mishandled them for years:    The world’s worst air isn’t in Beijing or New Delhi, it’s instead in a tiny town in Chile:",472
"British intelligence services must conduct a full review of the 2016 Brexit referendum to see whether hostile Russian action swayed the vote after the government failed to investigate, a panel of lawmakers said.",471
The inside story of how Europe landed its $860 billion stimulus plan.,471
"Jeff Bezos added $13 billion to his net worth on Monday, the largest single-day jump for an individual since the Bloomberg Billionaires Index was created in 2012.",471
"Here’s the latest in coronavirus news:    Hong Kong is facing its worst outbreak, and it’s woefully unprepared for the surge.",470
"The city seemed to dodge the virus until July, with daily local infections never surpassing 28, and that has left its defenses low.",470
Two doses of a coronavirus vaccine may be more effective than one.,470
But doubling the number of jabs per person raises a new challenge.,470
Cultural norms in different parts of Indonesia have wreaked havoc with the government’s attempts to curb infections.,470
Stealing the corpses of people who died from the virus is just one example.,470
A coronavirus vaccine the University of Oxford is developing with AstraZeneca shows promising results in early human testing:   The days of businesses shelling out hundreds on last-minute airfare are over.,469
"That’s bad news for airlines:   NFL players are reporting to camp, despite unresolved protocols and safety measures around the coronavirus pandemic:",469
The four EU governments that have been holding up negotiations over a massive stimulus package to reboot the bloc's economy are ready to agree on a key plank of the deal.,468
"Shares of Synairgen, a tiny pharmaceutical firm born out of a U.K. university, soared as much as 373% after the company said its experimental drug cut the risk of developing the worst symptoms of Covid-19.",468
"Meanwhile, scores of members of Russia's business and political elite have been given early access to an experimental vaccine against Covid-19.",468
Hello  Here's what we're following:   Japan will pay some companies a total of at least $536 million to move their factories out of China and back home or to Southeast Asia.,467
It's part of a new program to reduce dependence on Chinese manufacturing.,467
Think Tesla’s rally is impressive?,467
"A glove maker has seen its stock surge more than 1,000% this year following a boom in demand sparked by the pandemic.",467
And most of the world may face Covid without a vaccine.,467
"""There will be another wave, and it will be very serious,” former WHO virologist Klaus Stohr says.",467
Read more from our interview with him:,467
China is getting ready for its first mission to Mars:    Ghislaine Maxwell has always enjoyed proximity to wealth.,466
But how much money she has herself is a mystery:    Fear and glory are driving the global vaccine hunt:,466
A Ryanair flight that received a bomb threat mid-air was evacuated after landing safely in Oslo on Friday.,465
British Airways is retiring its entire fleet of Boeing 747s with immediate effect because of the damage the coronavirus has done to air travel.,465
"German Finance Minister Olaf Scholz was aware of potential market manipulation at Wirecard in February 2019, almost a year and a half before the company collapsed.",465
Anthony Fauci is optimistic that a new Covid treatment will be available by the fall.,464
"The top U.S. infectious disease expert told Mark Zuckerberg that he expects results by then for a clinical trial on monoclonal antibodies, which are lab-produced proteins he describes as “precise bullets.”   During that conversation between Fauci and Zuckerberg, the Facebook CEO said he was “disappointed” in the government’s response to the virus.",464
And China’s attack on its biggest stock wiped out a record $25 billion of value.,464
"Chinese state media took aim at the liquor group Kweichow Moutai for its high prices, saying its alcohol was often used in corruption cases.",464
"The U.K. accused Russia of trying to steal Covid-19 vaccine research:   Asheville, North Carolina, has voted to approve reparations for the Black community to make amends for the city’s role in slavery and racial inequality:   Florida has found that about a third of all children tested there are infected:",463
Pressure is growing on AstraZeneca to deliver positive results from early tests evaluating the coronavirus vaccine it's developing with University of Oxford researchers.,462
President Xi Jinping pledged to provide a better business environment for foreign firms as the Trump administration pushes for U.S. and other foreign companies to move their supply chains out of China.,462
"Fahim Saleh, the 33 year-old founder and CEO of startup Gokada, was found dead on Tuesday afternoon at his New York apartment.",462
China is no longer simply “rising.”,461
And it knows it.,461
"Under President Xi Jinping, the country’s leadership believes China can forcefully assert its agenda both at home and abroad because it’s reached the point where it can withstand any penalties that come its way.",461
"Western policies have largely failed to shape, slow or stop its growth.",461
Just look at the past month: Beijing imposed a sweeping national security law on Hong Kong despite global outrage and engaged in a deadly military skirmish on the border with India.,461
Countries are increasingly realizing they need to rethink how they deal with China.,461
Keep reading:,461
"Trump has indicated that he doesn’t want to further escalate tensions with China, and has ruled out additional sanctions on top officials for now:  Netflix is rewriting the script of the summer blockbuster:   Bill Gates, Elon Musk, Jeff Bezos, Barack Obama, Joe Biden and others were among the high-profile accounts that were apparently hacked on Twitter:",460
"Moderna's Covid-19 vaccine produced antibodies to the coronavirus in all patients tested in an initial safety trial, clearing an important milestone as the U.S. continues to grapple with a surge in new infections.",459
"Meanwhile, the University of Oxford's Covid-19 vaccine might be through human trials in September, and AstraZeneca has lined up agreements to produce 2 billion doses.",459
Hello  Here's what we're following right now:   President Trump ended Hong Kong’s special status with the U.S. as part of a punishment for China’s crackdown on political dissent in the city.,458
But the U.S. didn’t specify how the executive order would affect Hong Kong’s booming financial industry.,458
"Two weeks after India banned TikTok, its rival Roposo is booming there.",458
"The short-video app is peaking at 500,000 new users an hour and expects to have 100 million by the end of July.",458
"Chinese bankers are considering leaving Hong Kong, shocked by a 45% tax rate imposed by Beijing on citizens living outside the mainland.",458
The Trump administration backed down from a new policy requiring foreign students to leave the country if their schools switch to online-only classes:   Millions of Americans are relying on an extra $600 a week in federal help.,457
What happens when that lifeline expires?,457
Tracking the status of coronavirus vaccines:,457
"A potential new wave of coronavirus infections this winter poses a serious risk to the U.K. and could lead to as many as 120,000 hospital deaths from September to June, according to a report.",456
The EU is set to recommend keeping its external borders shut to Americans and most other foreigners for at least two more weeks as fears grow of a second coronavirus wave.,456
"A few months after a landmark trial in a sprawling German tax scandal, the multi-billion dollar probe is showing no signs of slowing down.",456
"You may have already gone back to the office, or you may be entering yet another week of working from home.",455
"Either way, maybe you’re thinking about relocating.",455
The pandemic may have proven you can do your job from anywhere.,455
"Before you talk to your manager about it, read these tips on how to handle the conversation:   If you’re simply not __ready__ to return to the office — for example, if you can’t line up child care — we’ve also got some advice on how to have that discussion with your boss.",455
For more tips on working from home:,455
It’s official.,454
"Waves of new infections in Florida, Texas and other states are hurting the U.S. economic recovery:  The death rate of Covid-19 is getting worse in majority black communities:    Dozens of millionaires from the U.S. and other countries have a message for their governments: “Tax us. Tax us. Tax us.”",454
"The fallout from coronavirus has provoked fears among the world's wealthy, who are worried about a shortage of cash in the event of another pandemic.",453
"Poland's ruling party beat back the biggest threat to its nationalist transformation, with incumbent Andrzej Duda poised to emerge the winner of Sunday's presidential election.",453
"Kelly Preston, actor and wife of John Travolta, died Sunday.",453
She was 57.,453
"Hello, here's what we're following:   The unshakable Hong Kong dollar is suddenly looking vulnerable after weeks of trading at the strong end of its band against the greenback.",452
The decline was unexpected and traders are watching the currency closely.,452
"White House adviser Peter Navarro said he expects President Trump to take ""strong action"" against Chinese-owned social media apps TikTok and WeChat for engaging in ""information warfare"" against the U.S.    Tesla needs to succeed in China if it wants to dominate the world of electric cars.",452
"To do that, Elon Musk is turning to a battery billionaire who once helped Apple extend the life of MacBooks.",452
"Trump says a phase two trade deal with China isn’t under consideration, claiming the relationship between Washington and Beijing is ""severely damaged"":    Stocks could be signaling the end of the bear market:    Can students come back to campus safely?",451
Schools are testing various solutions as the fall semester looms:,451
A new world order for the coronavirus era is emerging.,450
These are America's top paid CEOs.,450
The euro region's smallest nations staged an uprising to strike a blow against the bloc's major powers.,450
Global banks risk being caught between China-backed penalties and potential U.S. sanctions as Hong Kong’s autonomy becomes a volatile point of friction.,449
College dropout and serial entrepreneur Taku Toguchi has joined the ranks of Japanese founders building fortunes in artificial intelligence.,449
"His company, AI inside, is now one of the country's most richly valued — and his personal stake is worth $560 million.",449
"And on a sleepy island on the contested maritime boundary between North and South Korea, fear of military conflict is growing.",449
"Seoul MayorPark Won-soon, viewed as a potential candidate for the 2022 presidential election, has been found dead:   The Supreme Court upheld a New York grand jury subpoena for Trump's tax returns, but blocks a similar request from House Democrats for now:   Covid-19 is bankrupting American companies at a relentless pace:",448
"Coronavirus is flaring again in parts of Asia, with Hong Kong and Tokyo reporting record spikes in new infections.",447
Elon Musk says Tesla is “very close” to developing fully autonomous vehicles and could crack the puzzle this year.,447
A power pioneer has invented a new battery for just about everything that’s 90% cheaper than lithium-ion.,447
Singapore has one of the world’s highest rates of home ownership.,446
But how is a nation with one of Asia's most expensive housing markets able to offer such affordable apartments?,446
The answer stems from a decision made over 50 years ago.,446
"""There’s no way I can lose. Right now I'm feeling invincible.""",446
Euphoria is returning to China's stock market five years after an epic crash.,446
Warren Buffett is sinking down the ranks of the world’s richest people.,446
"He’s currently No. 8 on the Bloomberg Billionaires Index, his lowest position since the index was created in 2012.",446
"The U.S. government is ramping up coronavirus testing in Louisiana, Texas and Florida, as some states see a surge in Covid-19 infections:    Brooks Brothers has filed for bankruptcy, hit hard by the pandemic’s impact on clothing sales and its own heavy debt load:    Empty cruise ships are taking over the seas—and it's costing millions:",445
Boris Johnson warned Germany’s Angela Merkel that the U.K. is ready to do without a trade deal if the European Union wasn’t prepared to compromise.,444
"Kanye West says he no longer supports Donald Trump, and plans to run for president as an independent.",444
The world’s most popular hedge-fund strategy is no longer working.,444
"Hello   Here’s what we’re following today:   Top aides to President Trump want to undermine the Hong Kong dollar’s peg to the U.S. dollar as a way to punish China, sources say.",443
"But the idea faces strong opposition from others in the administration who worry that it would only hurt Hong Kong banks and the U.S., not China.",443
"The U.S. is also considering retaliation in the form of a ban on TikTok, whose parent company is China’s ByteDance.",443
"For its part, TikTok says it doesn’t feed user data to China.",443
"And in non-China news, Australia’s second-largest city plunged back into a six-week lockdown.",443
These are the mistakes that undid its early success.,443
"Brazilian President Jair Bolsonaro has tested positive for Covid-19:   3% of Americans have moved because of coronavirus, and 6% say they have someone living with them at least temporarily due to the outbreak:   New visa restrictions would make it so international students can’t stay in the U.S. without in-person courses:",442
"Europe's economy will suffer more than previously estimated this year and take longer to recover because of a slow easing of coronavirus restrictions, according to the EU's executive arm.",441
China's equity market is firmly in the spotlight after an almost unprecedented rally that helped lift global stocks to a one-month high.,441
"Ghislaine Maxwell spent the last few months at a secluded estate called ""Tuckedaway,"" the type of luxury retreat she's grown accustomed to as Jeffrey Epstein's girlfriend.",441
"Now, she's having to deal with accommodations that have been compared to a Turkish prison.",441
One of the many questions looming over Hong Kong’s new national security law is how tech companies will respond to it.,440
"It's already had a chilling effect on the city, and this could add another layer.",440
"Google, Twitter and Facebook said they won’t process user data requests as they review the law, which has sparked concern about criminalizing protests.",440
"Apple said it’s “assessing,” but that it hasn’t received requests for Hong Kong user data since the law kicked in last week.",440
It noted that it doesn’t get requests directly from the government there.,440
Keep reading:,440
"Uber agrees to buy Postmates for $2.65 billion to expand in food delivery:    As the coronavirus cases rise across the U.S., Trump's support is dropping:    Amazon shares keep climbing, topping $3,000 for the first time and extending a rally that has left most Wall Street analysts in the dust:",439
Global stock markets started the week with a bang after China's influential state media stoked bullish enthusiasm.,438
Banks are ditching their London offices—and not just because of the coronavirus.,438
"Ennio Morricone, the prolific composer and conductor who scored director Sergio Leone's so-called Spaghetti Westerns, has died.",438
The world economy is entering the second half of 2020 still deeply weighed down by the coronavirus.,437
"A full recovery has been ruled out for this year, and even a 2021 comeback depends on a lot going right.",437
Kanye West says he’s running for president.,437
"It’s not clear if he’s serious or if it’s just a PR stunt, but Twitter went wild.",437
And Warren Buffett finally found his next crisis-era deal.,437
"His company Berkshire Hathaway, which has stayed relatively quiet during the pandemic, made its biggest acquisition in more than four years.",437
"The U.S. government's mishandling of the coronavirus epidemic has dealt a heavy blow to the country's self-confidence and global standing, says former Treasury Secretary Larry Summers.",436
The world's biggest pension fund posted a record loss in the first three months of 2020 after the coronavirus pandemic sparked a global market rout.,436
"Emmanuel Macron asked his government, including Prime Minister Edouard Philippe, to resign on Friday as the French president seeks a fresh start after a disastrous election last month.",436
Hong Kong's government has declared illegal a key slogan chanted by hundreds of thousands of protesters.,435
It's the latest sign authorities plan to use a new Beijing-drafted national security law to enforce limits on free speech.,435
It's the plane that shrank the world.,435
"But now Boeing is quietly pulling the plug on the 747, ending the era of jumbo jets after half a century.",435
A 28-year-old with no degree has become a must-read on the economy.,435
"Here's how he caught the eye of the Fed, the Treasury department and Wall Street.",435
"Longtime confidante of disgraced money manager Jeffrey Epstein, Ghislaine Maxwell, was arrested and charged with conspiracy and enticing minors to engage in sex:    The U.S. added 4.8 million new jobs in June.",434
"It reflects a snapshot of mid-month conditions after a flurry of rehiring — particularly at restaurants and retailers — but before reopenings screeched to a halt amid rising virus cases around the country:   Over the years, bosses have held down wages, cut benefits, and stomped on employees’ rights.",434
Covid-19 may change that:,434
"The world needs more than one vaccine to tackle the new coronavirus, said U.S. infectious-disease expert Anthony Fauci.",433
"U.S. daily coronavirus cases topped 50,000 for the first time on Wednesday with increases in major states including Florida, Texas and California.",433
"China warned of strong countermeasures if the U.S., Australia and the U.K. continued taking actions in response to Beijing's tough national security law in Hong Kong.",433
Hello  Here's what we're reading today:   A Chinese firm is now at the front of the virus vaccine race.,432
It's a sign the country's young biotech industry is becoming a global contender.,432
